{
  "rfq_id": "rfq-002",
  "version": 1,
  "status": "submitted",
  "occasion": {
    "type": "surprise",
    "details": {
      "celebrations": [
        { "kind": "birthday", "day": "2026-12-05", "age": 30, "decor": true, "cake": true }
      ],
      "privacy": true,
      "notes": "partner must not know until arrival"
    }
  },
  "destination": { "mode": "suggest_for_me", "region_pref": "beach" },
  "dates": { "start": "2026-12-04", "end": "2026-12-07", "flex_days": 1 },
  "travellers": { "adults": 2, "kids": [] },
  "hotel": { "budget_per_night": { "amount": 900000, "currency": "INR" }, "category": 4 },
  "inclusions": ["meals", "transfers", "activities", "experiences"]
}
