{
  "rfq_id": "rfq-004",
  "version": 2,
  "itinerary_id": "itin-004",
  "status": "quoted",
  "occasion": { "type": "adventure" },
  "destination": { "mode": "place", "place": "Manali" },
  "dates": { "start": "2027-01-10", "end": "2027-01-15", "flex_days": 3 },
  "travellers": { "adults": 4, "kids": [] },
  "hotel": { "budget_per_night": { "amount": 600000, "currency": "INR" }, "category": 3 },
  "inclusions": ["transfers", "activities"]
}
