{
  "rfq_id": "rfq-005",
  "version": 1,
  "itinerary_id": "itin-005",
  "status": "quoting",
  "occasion": {
    "type": "celebration",
    "details": {
      "celebrations": [
        { "kind": "birthday", "day": "2026-10-13", "age": 5, "cake": true },
        { "kind": "anniversary", "day": "2026-10-14", "decor": true }
      ],
      "privacy": false
    }
  },
  "destination": { "mode": "place", "place": "Ooty" },
  "dates": { "start": "2026-10-12", "end": "2026-10-16", "flex_days": 1 },
  "travellers": { "adults": 2, "kids": [{ "age": 5 }] },
  "hotel": { "budget_per_night": { "amount": 500000, "currency": "INR" }, "category": 4 },
  "inclusions": ["meals", "transfers", "activities", "experiences"]
}
